{
  "schemaVersion": "1.0.0",
  "registerId": "glitz-pride-ai-knowledge-sources",
  "projectId": "glitz-pride",
  "asOfDate": "2026-10-11",
  "governance": {
    "retrievalRule": "Only approved or approved-with-qualifications sources may support an answer. Qualifications must appear beside every affected claim.",
    "pendingRule": "Pending sources are catalogue placeholders and must not be indexed for answer generation.",
    "conflictRule": "Prefer the highest authority tier and newest effective record. If precedence is not explicit, show the conflict and escalate.",
    "expiryRule": "An expired or overdue source becomes unavailable for changing facts until reviewed.",
    "derivedRule": "A derived source cannot have a stronger approval state, broader use, or later effective truth than its governing primary source."
  },
  "sources": [
    {
      "id": "KS-001",
      "title": "Official Glitz Pride development brochure",
      "category": "brochure",
      "authorityTier": "primary-document",
      "decision": "approved-with-qualifications",
      "owner": "Glitz Pride property owner",
      "steward": "AKHIL",
      "location": "project-assets/official/Glitz_Brochure.pdf",
      "format": "pdf",
      "effectiveDate": "2018-12-27",
      "lastVerifiedOn": "2026-10-10",
      "reviewCadenceDays": 90,
      "allowedUses": [
        "project story",
        "brochure-listed villa areas",
        "brochure-listed amenities",
        "brochure specifications",
        "illustrative plans",
        "illustrative location and landmark distances",
        "brochure-listed contacts"
      ],
      "prohibitedUses": [
        "live pricing",
        "live availability",
        "current construction status",
        "legal or RERA status",
        "contractual guarantee",
        "installed-system guarantee",
        "current operating hours"
      ],
      "approvalEvidence": "APR-003 in docs/content/content-register.md",
      "reviewTrigger": "New brochure, changed project fact, owner correction, or 90-day review",
      "notes": "Owner approval covers the current qualified public presentation. The brochure remains historical and does not make changing facts current."
    },
    {
      "id": "KS-002",
      "title": "Governed structured project content",
      "category": "structured-project-data",
      "authorityTier": "governed-derivative",
      "decision": "approved-with-qualifications",
      "owner": "Glitz Pride property owner",
      "steward": "AKHIL",
      "location": "content/data/glitz-pride.json",
      "format": "json",
      "effectiveDate": "2026-10-03",
      "lastVerifiedOn": "2026-10-11",
      "reviewCadenceDays": 30,
      "allowedUses": [
        "deterministic previews",
        "brochure-backed retrieval",
        "villa-area arithmetic",
        "source locators",
        "unknown-value handling"
      ],
      "prohibitedUses": [
        "overriding KS-001",
        "removing source qualifications",
        "turning null or unknown fields into facts"
      ],
      "approvalEvidence": "Derived from KS-001 and governed by APR-003",
      "reviewTrigger": "Any parent-source, schema, extraction, or approval change",
      "notes": "Every record inherits the authority and limitations of its evidence."
    },
    {
      "id": "KS-003",
      "title": "Owner approval for the qualified public presentation",
      "category": "publication-approval",
      "authorityTier": "owner-confirmation",
      "decision": "approved",
      "owner": "Glitz Pride property owner",
      "steward": "AKHIL",
      "location": "docs/content/content-register.md#owner-approval-record",
      "format": "approval-record",
      "effectiveDate": "2026-10-10",
      "lastVerifiedOn": "2026-10-10",
      "reviewCadenceDays": null,
      "allowedUses": [
        "prove permission for the exact qualified Phase 1 presentation"
      ],
      "prohibitedUses": [
        "verify underlying property facts",
        "approve new content",
        "remove qualifications"
      ],
      "approvalEvidence": "APR-003",
      "reviewTrigger": "Any content, media, claim, contact, or qualification change",
      "notes": "This is publication approval, not a live commercial or legal source."
    },
    {
      "id": "KS-004",
      "title": "Approved WhatsApp destination",
      "category": "contact-routing",
      "authorityTier": "owner-confirmation",
      "decision": "approved",
      "owner": "AKHIL",
      "steward": "AKHIL",
      "location": "docs/content/content-register.md#owner-approval-record",
      "format": "approval-record",
      "effectiveDate": "2026-10-11",
      "lastVerifiedOn": "2026-10-11",
      "reviewCadenceDays": 90,
      "allowedUses": [
        "display the approved WhatsApp action",
        "prepare a neutral project-enquiry message after a user click"
      ],
      "prohibitedUses": [
        "automatic messaging",
        "sharing form data",
        "claiming response times",
        "disclosing additional personal information"
      ],
      "approvalEvidence": "APR-004",
      "reviewTrigger": "Number, recipient, purpose, operating hours, or message changes",
      "notes": "The approved number is +91 98954 68235."
    },
    {
      "id": "KS-005",
      "title": "Legacy Glitz Homes website",
      "category": "legacy-website",
      "authorityTier": "discovery-reference",
      "decision": "superseded",
      "owner": "Glitz Homes",
      "steward": "AKHIL",
      "location": "http://www.glitzhomes.co.in/",
      "format": "website",
      "effectiveDate": null,
      "lastVerifiedOn": "2026-09-03",
      "reviewCadenceDays": null,
      "allowedUses": ["audit provenance of retained reference assets"],
      "prohibitedUses": [
        "answer generation",
        "current facts",
        "current contacts",
        "pricing",
        "availability",
        "legal claims"
      ],
      "approvalEvidence": "Superseded by APR-003 for the current presentation",
      "reviewTrigger": "None; replacement requires a new approval record",
      "notes": "The website was reported inactive and its material must not be treated as current evidence."
    },
    {
      "id": "KS-006",
      "title": "Current production website pages",
      "category": "published-application",
      "authorityTier": "governed-derivative",
      "decision": "approved-with-qualifications",
      "owner": "Glitz Pride property owner",
      "steward": "AKHIL",
      "location": "https://glitz-pride-community.vercel.app/",
      "format": "website",
      "effectiveDate": "2026-10-11",
      "lastVerifiedOn": "2026-10-11",
      "reviewCadenceDays": 30,
      "allowedUses": [
        "navigation help",
        "link previews",
        "explain visible qualified content"
      ],
      "prohibitedUses": [
        "use as independent evidence",
        "override primary sources",
        "infer omitted facts"
      ],
      "approvalEvidence": "APR-003 and Phase 1 release record",
      "reviewTrigger": "Deployment, content, route, or primary-source change",
      "notes": "Published pages are outputs of governed sources, not an independent truth source."
    },
    {
      "id": "KS-007",
      "title": "Brand identity and media-rights package",
      "category": "brand-and-media-rights",
      "authorityTier": "required-primary-source",
      "decision": "pending",
      "owner": "Glitz Pride property owner or documented rights holder",
      "steward": "AKHIL",
      "location": null,
      "format": "documents-and-assets",
      "effectiveDate": null,
      "lastVerifiedOn": null,
      "reviewCadenceDays": 365,
      "allowedUses": [],
      "prohibitedUses": [
        "new publication",
        "rights claims",
        "unqualified image reuse"
      ],
      "approvalEvidence": null,
      "reviewTrigger": "Rights holder supplies written permission or replacement assets",
      "notes": "APR-003 covers only the exact current qualified presentation."
    },
    {
      "id": "KS-008",
      "title": "Current villa catalogue and approved floor plans",
      "category": "villa-and-plans",
      "authorityTier": "required-primary-source",
      "decision": "pending",
      "owner": "Glitz Pride property owner or project architect",
      "steward": "AKHIL",
      "location": null,
      "format": "structured-data-and-approved-plans",
      "effectiveDate": null,
      "lastVerifiedOn": null,
      "reviewCadenceDays": 90,
      "allowedUses": [],
      "prohibitedUses": [
        "room-count claims",
        "dimensions",
        "plan scale",
        "customisation claims",
        "catalogue completeness"
      ],
      "approvalEvidence": null,
      "reviewTrigger": "Approved schedule and signed or revision-controlled plans supplied",
      "notes": "The brochure plan remains available only under KS-001 qualifications."
    },
    {
      "id": "KS-009",
      "title": "Current technical and contractual specifications",
      "category": "specifications",
      "authorityTier": "required-primary-source",
      "decision": "pending",
      "owner": "Glitz Pride property owner or project architect",
      "steward": "AKHIL",
      "location": null,
      "format": "revision-controlled-document",
      "effectiveDate": null,
      "lastVerifiedOn": null,
      "reviewCadenceDays": 90,
      "allowedUses": [],
      "prohibitedUses": [
        "brand guarantees",
        "material guarantees",
        "contractual inclusion",
        "substitution policy"
      ],
      "approvalEvidence": null,
      "reviewTrigger": "Signed current specification or owner-approved revision supplied",
      "notes": "Brochure-listed specifications remain historical references."
    },
    {
      "id": "KS-010",
      "title": "Amenity delivery and operating-status register",
      "category": "amenities",
      "authorityTier": "required-live-source",
      "decision": "pending",